"id","description","likes","productId","sharingLink","username","userProfileImage","videoUrl"
"04","Mens esthetic shirts","500","9","link to product page to share copy link","james131","https://orionstorage.s3.ap-south-1.amazonaws.com/profile/video-4.PNG","https://orionstorage.s3.ap-south-1.amazonaws.com/shortFormat/short-format-4.mp4"
"02","Blues with peace. Take a look at this new trendy white shirts","12","7\n","link to product page to share copy link","james1","https://orionstorage.s3.ap-south-1.amazonaws.com/profile/video-2.PNG","https://orionstorage.s3.ap-south-1.amazonaws.com/shortFormat/short-format-2.mp4"
"06","What a party waer it is check this out","40","11","link to product page to share copy link","maddona","https://orionstorage.s3.ap-south-1.amazonaws.com/profile/video-6.PNG","https://orionstorage.s3.ap-south-1.amazonaws.com/shortFormat/short-format-6.mp4"
"05","""Shiny like stars, check this new outfit""","20","10","link to product page to share copy link","jemini","https://orionstorage.s3.ap-south-1.amazonaws.com/profile/video-5.PNG","https://orionstorage.s3.ap-south-1.amazonaws.com/shortFormat/short-format-5.mp4"
"01","I bought this from orion have a look at this new trending collection","500","6","link to product page to share copy link","antilia990","https://orionstorage.s3.ap-south-1.amazonaws.com/profile/video-1.PNG","https://orionstorage.s3.ap-south-1.amazonaws.com/shortFormat/short-format-1.mp4"
"03","""This outfit is a perfect fit ""","35","1","link to product page to share copy link","maina2","https://orionstorage.s3.ap-south-1.amazonaws.com/profile/video-3.PNG","https://orionstorage.s3.ap-south-1.amazonaws.com/shortFormat/short-format-3.mp4"